{
  "benchmark_version": "insightos-ba-da-diagnostic-v2",
  "modes": [
    "base",
    "context_assisted",
    "tool_assisted"
  ],
  "diagnostic_pairs": [
    {
      "pair_id": "margin_formula_context",
      "case_id": "calc_margin",
      "compare_modes": [
        "base",
        "context_assisted"
      ],
      "diagnostic_question": "Does the controlled definition/formula card change formula selection or numerical accuracy?"
    },
    {
      "pair_id": "weighted_average_context",
      "case_id": "calc_weighted_avg",
      "compare_modes": [
        "base",
        "context_assisted"
      ],
      "diagnostic_question": "Does the weighted-mean method card change method selection or calculation?"
    },
    {
      "pair_id": "variance_definition_context",
      "case_id": "stat_population_sample",
      "compare_modes": [
        "base",
        "context_assisted"
      ],
      "diagnostic_question": "Does explicit population/sample definition context change denominator selection?"
    },
    {
      "pair_id": "statistical_interpretation_context",
      "case_id": "stat_ci_interpretation",
      "compare_modes": [
        "base",
        "context_assisted"
      ],
      "diagnostic_question": "Does a controlled definition card change interpretation of confidence-interval coverage?"
    },
    {
      "pair_id": "missing_context_card",
      "case_id": "ba_churn_definition",
      "compare_modes": [
        "base",
        "context_assisted"
      ],
      "diagnostic_question": "Does a general churn-definition card improve missing-input recognition? This does not measure retrieval."
    },
    {
      "pair_id": "sql_contract_assistance",
      "case_id": "tool_sql_group_query",
      "compare_modes": [
        "base",
        "tool_assisted"
      ],
      "diagnostic_question": "Does an explicit SQL tool contract improve tool-call shape or query construction? This benchmark does not execute model SQL."
    },
    {
      "pair_id": "calculator_argument_assistance",
      "case_id": "tool_arguments_valid",
      "compare_modes": [
        "base",
        "tool_assisted"
      ],
      "diagnostic_question": "Does a declared calculator contract improve tool choice and argument validity?"
    },
    {
      "pair_id": "observed_success_trace",
      "case_id": "tool_trace_result_grounding",
      "compare_modes": [
        "base",
        "tool_assisted"
      ],
      "diagnostic_question": "Does the visible successful trace improve result reporting? It is not evidence of unaided calculation."
    },
    {
      "pair_id": "observed_failure_trace",
      "case_id": "tool_failed_execution",
      "compare_modes": [
        "base",
        "tool_assisted"
      ],
      "diagnostic_question": "Does the visible failed trace support honest failure reporting rather than an unsupported success claim?"
    }
  ],
  "categories": [
    {
      "id": "business_analyst",
      "name": "Business Analyst knowledge and requirements reasoning",
      "case_count": 10
    },
    {
      "id": "data_analyst",
      "name": "Data Analyst knowledge and analytical workflows",
      "case_count": 10
    },
    {
      "id": "arithmetic_calculations",
      "name": "Arithmetic and business calculations",
      "case_count": 10
    },
    {
      "id": "statistics_probability",
      "name": "Statistics and probability",
      "case_count": 10
    },
    {
      "id": "dataset_reasoning",
      "name": "Dataset reasoning and interpretation",
      "case_count": 10
    },
    {
      "id": "tools_reliability",
      "name": "Tool use, instructions, and output reliability",
      "case_count": 10
    }
  ],
  "context_cards": [
    {
      "id": "business_metrics",
      "text": "Revenue is sales income before expenses. Profit is revenue minus expenses. Profit margin is profit divided by revenue, multiplied by 100. Churn rate requires a defined customer population, a count of customers lost, and a measurement period."
    },
    {
      "id": "statistics_basics",
      "text": "Population variance divides the sum of squared deviations by N. Sample variance divides by n-1. A confidence interval describes uncertainty in a procedure's estimate; a p-value is the probability, under the null model, of data at least as extreme as observed."
    },
    {
      "id": "data_workflows",
      "text": "Profile types, missingness, duplicates, ranges, and distributions before analysis. A one-to-many join can duplicate values from the one-side. A weighted mean uses each group's count as its weight. Association alone does not establish causation."
    }
  ],
  "tool_contracts": [
    {
      "id": "calculator",
      "name": "calculate",
      "description": "Evaluate one arithmetic expression using decimal arithmetic.",
      "arguments_schema": {
        "type": "object",
        "properties": {
          "expression": {
            "type": "string"
          }
        },
        "required": [
          "expression"
        ],
        "additionalProperties": false
      }
    },
    {
      "id": "sql_readonly",
      "name": "query_readonly_sql",
      "description": "Run a read-only SELECT query against the supplied in-memory fixture database.",
      "arguments_schema": {
        "type": "object",
        "properties": {
          "sql": {
            "type": "string"
          }
        },
        "required": [
          "sql"
        ],
        "additionalProperties": false
      }
    },
    {
      "id": "describe_statistics",
      "name": "summarize_sample",
      "description": "Return specified descriptive statistics for named numeric columns.",
      "arguments_schema": {
        "type": "object",
        "properties": {
          "column": {
            "type": "string"
          },
          "statistics": {
            "type": "array",
            "items": {
              "type": "string",
              "enum": [
                "mean",
                "median",
                "sample_variance",
                "population_variance"
              ]
            }
          }
        },
        "required": [
          "column",
          "statistics"
        ],
        "additionalProperties": false
      }
    }
  ],
  "cases": [
    {
      "case_id": "ba_requirements_vs_solution",
      "family_id": "ba_requirements",
      "category": "business_analyst",
      "skill": "requirements_vs_solution",
      "difficulty": "introductory",
      "split": "development",
      "prompt": "A sponsor says, 'Build a dashboard with a red alert button.' State one business requirement you would clarify and distinguish it from this proposed solution.",
      "inputs": {
        "context": "The sponsor has not stated the decision or outcome the alert should support."
      },
      "modes": [
        "base",
        "context_assisted"
      ],
      "allowed_context_ids": [],
      "allowed_tool_ids": [],
      "scoring_dimensions": [
        "conceptual_correctness",
        "business_relevance",
        "evidence_uncertainty"
      ],
      "likely_failure_categories": [
        "concept_gap",
        "missing_context_error"
      ]
    },
    {
      "case_id": "ba_stakeholder_authority",
      "family_id": "ba_stakeholder",
      "category": "business_analyst",
      "skill": "stakeholder_analysis",
      "difficulty": "intermediate",
      "split": "development",
      "prompt": "A reporting change affects sales representatives, finance, and compliance. Who should be consulted, and what must be clarified before assigning approval authority?",
      "inputs": {
        "context": "No organization chart, decision rights, or regulatory jurisdiction is supplied."
      },
      "modes": [
        "base",
        "context_assisted"
      ],
      "allowed_context_ids": [],
      "allowed_tool_ids": [],
      "scoring_dimensions": [
        "conceptual_correctness",
        "business_relevance",
        "evidence_uncertainty"
      ],
      "likely_failure_categories": [
        "concept_gap",
        "missing_context_error"
      ]
    },
    {
      "case_id": "ba_retention_kpi",
      "family_id": "clarify_missing_information",
      "category": "business_analyst",
      "skill": "kpi_definition",
      "difficulty": "intermediate",
      "split": "validation",
      "prompt": "Propose a measurable customer-retention KPI and specify the cohort, period, numerator, and denominator that must be defined.",
      "inputs": {
        "context": "No product, customer lifecycle, or business definition of retained is supplied."
      },
      "modes": [
        "base",
        "context_assisted"
      ],
      "allowed_context_ids": [
        "business_metrics"
      ],
      "allowed_tool_ids": [],
      "scoring_dimensions": [
        "clarification_completeness",
        "conceptual_correctness",
        "evidence_uncertainty",
        "formula_method_selection",
        "unsupported_claims"
      ],
      "likely_failure_categories": [
        "concept_gap",
        "formula_selection_error",
        "missing_context_error"
      ]
    },
    {
      "case_id": "ba_order_bottleneck",
      "family_id": "ba_order_flow",
      "category": "business_analyst",
      "skill": "process_analysis",
      "difficulty": "intermediate",
      "split": "hidden_test",
      "prompt": "Orders spend 1 hour in intake, 18 hours awaiting approval, and 2 hours in fulfillment. Identify the observed bottleneck and one follow-up question before recommending a change.",
      "inputs": {
        "stage_hours": {
          "intake": 1,
          "approval": 18,
          "fulfillment": 2
        }
      },
      "modes": [
        "base",
        "context_assisted"
      ],
      "allowed_context_ids": [],
      "allowed_tool_ids": [],
      "scoring_dimensions": [
        "conceptual_correctness",
        "business_relevance",
        "evidence_uncertainty"
      ],
      "likely_failure_categories": [
        "concept_gap",